{"schema_version": "1.0", "artifact_type": "g01-human-review", "task_id": "SCRUM-140", "repository": "nhatnguyenquang1838-coder/gwc", "base_sha": "43daebcffbd71cf0339c4de8c82d3c91db95be1d", "generated_at_utc": "2026-07-26T07:30:00Z", "gates": {"g0": "READY", "g1": "PASS", "g2": "APPROVED"}, "impact_ref": {"path": ".gwc/tasks/SCRUM-140/g1/g1-option-impact.yaml", "sha256": "sha256:2222222222222222222222222222222222222222222222222222222222222222"}, "html": {"template_version": "1.0", "title": "SCRUM-140 Human Review", "sections": ["summary", "task_me", "ua", "options", "authority"], "self_contained": true, "remote_assets_allowed": false}, "presentation": {"chat_summary": "G0/G1 review is ready.", "slack_summary": "G0/G1 review ready in the task thread.", "html_ref": "g01-human-review.html", "slack_thread_required": true}, "presentation_state": "CURRENT", "authority_notice": "This derived review does not grant G2, G3, G4, G5, or G6 authority."}